,Company/Brand,Stage,Amount($),HeadQuarter,What_it_does,Sector,Funding_Year,Founded,Founders,Investor,Startup_Age
0,TheCollegeFever,Seed,250000.0,Bangalore,"TheCollegeFever is a hub for fun, fiesta and frolic of Colleges.",Media & Entertainment,2018,2016,unknown,unknown,2
1,Happy Cow Dairy,Seed,1000000.0,Mumbai,A startup which aggregates milk from dairy farmers in rural Maharashtra.,Agriculture,2018,2016,unknown,unknown,2
2,MyLoanCare,Series A,1000000.0,Gurgaon,Leading Online Loans Marketplace in India,Finance,2018,2016,unknown,unknown,2
3,PayMe India,Angel,2000000.0,Noida,PayMe India is an innovative FinTech organization which offers short term financial suport to corporate employees.,Finance,2018,2016,unknown,unknown,2
4,Eunimart,Seed,1000000.0,Hyderabad,Eunimart is a one stop solution for merchants to create a difference by selling globally.,E-commerce,2018,2016,unknown,unknown,2
5,Hasura,Seed,1600000.0,Bangalore,"Hasura is a platform that allows developers to build, deploy, and host cloud-native applications quickly.",Technology,2018,2016,unknown,unknown,2
6,Tripshelf,Seed,1000000.0,Kalkaji,Tripshelf is an online market place for holiday packages.,Lifestyle,2018,2016,unknown,unknown,2
7,Hyperdata.IO,Angel,1000000.0,Hyderabad,Hyperdata combines advanced machine learning with human intelligence.,Services,2018,2016,unknown,unknown,2
8,Freightwalla,Seed,1000000.0,Mumbai,Freightwalla is an international forwarder thats helps you manage supply chain by providing online tools including instant quotations.,Technology,2018,2016,unknown,unknown,2
9,Microchip Payments,Seed,1000000.0,Bangalore,Microchip payments is a mobile-based payment application and point-of-sale device,Services,2018,2016,unknown,unknown,2
10,BizCrum Infotech Pvt. Ltd.,Seed,1000000.0,Delhi,Building Transactionary B2B Marketplaces,E-commerce,2018,2016,unknown,unknown,2
11,Emojifi,Seed,1000000.0,Bangalore,"Emojifi is an app that provides live emoji, stickers & GIFs suggestions based on the typed words across chat platforms.",Technology,2018,2016,unknown,unknown,2
12,Flock,Seed,1000000.0,India,Flock is a real-time messaging and collaboration app for teams that speeds up and simplifies communication and boosts productivity.,Technology,2018,2016,unknown,unknown,2
13,Freshboxx,Seed,1000000.0,Hubli,"Freshboxx is incubated at Sandbox Startups, a unit of the Deshpande Foundation.",Transportation & Logistics,2018,2016,unknown,unknown,2
14,Wide Mobility Mechatronics,Seed,1000000.0,Bangalore,Wide Mobility Mechatronics is a Private Company limited by Shares,Technology,2018,2016,unknown,unknown,2
15,Pitstop,Seed,1000000.0,Bangalore,Pitstop offers general repair and maintenance services for cars through its doorstep service vehicles.,Engineering,2018,2016,unknown,unknown,2
16,Mihuru,Seed,150000.0,Mumbai,Mihuru is an online platform which gives micro loans for air travel .,Technology,2018,2016,unknown,unknown,2
17,Fyle,Seed,1100000.0,Bangalore,Fyle is an intelligent expense management platform for enterprises.,Technology,2018,2016,unknown,unknown,2
18,AppWharf,Seed,1000000.0,New Delhi,Appwharf is an intelligent assistant that helps find you the best-fit SaaS for your business.,Technology,2018,2016,unknown,unknown,2
19,Antariksh Waste Ventures Pvt ltd,Seed,1000000.0,Chennai,Waste Management for Smart Cities,Technology,2018,2016,unknown,unknown,2
20,Cogoport,Series A,6000000.0,Mumbai,Cogoport is a platform that provides freight buying industry with spot rates and bidding process for freight buyers.,Transportation & Logistics,2018,2016,unknown,unknown,2
21,PaisaDukan,Seed,650000.0,Mumbai,A P2P lending marketplace platform,Finance,2018,2016,unknown,unknown,2
22,Sleepy Owl Coffee,Seed,1000000.0,New Delhi,"Makers of a signature coffee that's exceptional in taste. It's super easy to brew, requires no equipment & ships to your door.",Food & Beverages,2018,2016,unknown,unknown,2
23,BlueJack,Seed,1000000.0,Delhi,Delhi-based online used vehicles marketplace.,Transportation & Logistics,2018,2016,unknown,unknown,2
24,PregBuddy,Seed,1000000.0,Bangalore,PregBuddy is a smart connected care platform for expecting mothers.,Healthcare,2018,2016,unknown,unknown,2
25,AgNext Technologies,Series A,1000000.0,Mohali,AgNext is an agricultural sensing and solutions company focused on building data-driven solutions for agricultural stakeholders,Agriculture,2018,2016,unknown,unknown,2
26,Pando,Seed,2000000.0,Chennai,A startup which digitizes logistics operations for Fortune 500 companies.,Transportation & Logistics,2018,2016,unknown,unknown,2
27,Mintifi,Seed,2000000.0,Mumbai,Online lending startup based in Mumbai.,Finance,2018,2016,unknown,unknown,2
28,Carcrew,Seed,2000000.0,Mumbai,India's Online Auto Repair Marketplace,Engineering,2018,2016,unknown,unknown,2
29,NicheAI,Angel,1000000.0,Hyderabad,Early stage Artificial Intelligence (AI) start up.,Technology,2018,2016,unknown,unknown,2
30,Chariot Tech,Seed,1000000.0,New Delhi,Chariot Tech is an Internet of Things (IoT) startup based in New Delhi.,Technology,2018,2016,unknown,unknown,2
31,Ideal Insurance Brokers/ 121Policy.com,Seed,1000000.0,Kolkata,Ideal Insurance Broking is one of the leaders in insurance broking domain.,Finance,2018,2016,unknown,unknown,2
32,Loanzen,Seed,1000000.0,Bangalore,Loanzen helps small businesses get unsecured working capital loans against their their pending invoices.,Finance,2018,2016,unknown,unknown,2
33,Mojro Technologies,Seed,650000.0,Bangalore,Mojro envisions to be the world's largest technology-enabled logistics platform.,Transportation & Logistics,2018,2016,unknown,unknown,2
34,Elemential,Seed,1000000.0,Mumbai,"Blockchain Development Platform To Design, Run & Scale Blockchain Networks.",Technology,2018,2016,unknown,unknown,2
35,Loadshare,Series A,5000000.0,Bangalore,LoadShare is India’s fastest growing logistics company,Transportation & Logistics,2018,2016,unknown,unknown,2
36,Yumlane,Series A,4000000.0,Mumbai,Food startup Yumlane operated by QwikPik Technology,Food & Beverages,2018,2016,unknown,unknown,2
37,Kriger Campus,Seed,1000000.0,New Delhi,A Education Start Up.,Education,2018,2016,unknown,unknown,2
38,Pipa+Bella,Series A,1000000.0,Mumbai,Pipa+Bella is an online store aimed at selling fashionable and affordable costume jewelry at par with international standards and trends,Retail,2018,2016,unknown,unknown,2
39,Kaleidofin,Seed,2800000.0,Chennai,A fintech platform.,Finance,2018,2016,unknown,unknown,2
40,Chakr Innovation,Seed,1000000.0,New Delhi,Chakr has developed the world’s first retro-fit emission control device for diesel generators.,Energy,2018,2016,unknown,unknown,2
41,IndigoLearn,Seed,150000.0,Hyderabad,India's the premier education destination catering to the needs of aspiring students of the CA community.,Education,2018,2016,unknown,unknown,2
42,UClean,Seed,1000000.0,India,UClean is a tech enabled laundry service provider.,Services,2018,2016,unknown,unknown,2
43,Coutloot,Seed,1000000.0,Mumbai,The Fashion Re-commerce platform.,E-commerce,2018,2016,unknown,unknown,2
44,Letstrack,Seed,1700000.0,New Delhi,"Letstrack GPS tracking devices to track your kids, bike, car and other vehicles. GPS trackers for Vehicle Tracking System in India.",Transportation & Logistics,2018,2016,unknown,unknown,2
45,Pooltoo,Seed,1000000.0,New Delhi,Pooltoo offers a premium ride sharing platform.,Transportation & Logistics,2018,2016,unknown,unknown,2
46,Finzy,Seed,1300000.0,Bangalore,finzy is the premier peer to peer lending solution in India.,Finance,2018,2016,unknown,unknown,2
47,Fitternity,Seed,2000000.0,Mumbai,India's largest online fitness platform that provides an integrated eco-system to help users start & sustain their fitness journey,Healthcare,2018,2016,unknown,unknown,2
48,Keito,Seed,1000000.0,Pune,Building an Intelligent Digital Assistant.,Technology,2018,2016,unknown,unknown,2
49,Tolet for Students,Seed,1000000.0,Jodhpur,"Reserve your Room, Hostel or Paying Guest, while relocating for higher education.",Hospitality,2018,2016,unknown,unknown,2
50,Chai Kings,Seed,1000000.0,Chennai,Chai Kings is a tea retail chain,Food & Beverages,2018,2016,unknown,unknown,2
51,Dainik Jagran,Seed,1000000.0,Kanpur,Dainik Jagran is a media and communications group.,Media & Entertainment,2018,2016,unknown,unknown,2
52,Playtoome,Seed,1000000.0,Bangalore,Playtoome is a live entertainment destination,Media & Entertainment,2018,2016,unknown,unknown,2
53,ONGO Framework,Angel,1000000.0,Hyderabad,ONGO Framework is a B2B IT and digital solution provider.,Technology,2018,2016,unknown,unknown,2
54,Notesgen,Seed,1000000.0,New Delhi,A Global Peer-to-Peer and Peer-to-Group Learning Platform that helps students supplement their academic & competitive exam prep.,Education,2018,2016,unknown,unknown,2
55,Arogya MedTech,Seed,1000000.0,Kolkata,Arogya MedTech is a Research & Development organization in Bio-Medical industry.,Healthcare,2018,2016,unknown,unknown,2
56,Propshop24,Seed,500000.0,Mumbai,"Propshop24, a one-stop shop for a handpicked selection of 'fun'tastic products from around the world.",E-commerce,2018,2016,unknown,unknown,2
57,myUpchar,Series A,5000000.0,New Delhi,To bring health issues to people in their language.,Healthcare,2018,2016,unknown,unknown,2
58,MissMalini Entertainment,Seed,1000000.0,Mumbai,"MissMalini Entertainment is a multi-platform new media network dedicated to Entertaining, Connecting & Empowering young Indians.",Technology,2018,2016,unknown,unknown,2
59,Rooter,Seed,1000000.0,India,Rooter is a mobile-based platform,Sports,2018,2016,unknown,unknown,2
60,ZestMoney,Series A,13400000.0,Bangalore,Zest is India's first completely automated consumer digital lending platform.,Finance,2018,2016,unknown,unknown,2
61,alphaics Corporation,Seed,1000000.0,Bangalore,Advancing AI compute,Technology,2018,2016,unknown,unknown,2
62,MyDentistChoice,Seed,500000.0,Hyderabad,MyDentistChoice is a direct sales and distribution of dental equipment and accessories from top name manufacturers,Healthcare,2018,2016,unknown,unknown,2
63,Sattviko,Angel,1000000.0,New Delhi,Sattviko fosters wellness and shares Indianness through the Sattvik way of cooking that is wholesome and tasty!,Food & Beverages,2018,2016,unknown,unknown,2
64,Sensibull,Seed,1000000.0,Bangalore,Investment Management Platform,E-commerce,2018,2016,unknown,unknown,2
65,Bombay Shaving Company,Series A,1000000.0,New Delhi,Bombay Shaving Company is a Men's grooming startup,Lifestyle,2018,2016,unknown,unknown,2
66,MedCords,Seed,1000000.0,Pune,Medcords is India’s first holistic healthcare ecosystem on a cloud platform that makes health management easier,Lifestyle,2018,2016,unknown,unknown,2
67,University Living,Seed,1000000.0,New Delhi,University Living is an online global student housing marketplace.,Education,2018,2016,unknown,unknown,2
68,&ME,Seed,1000000.0,Bangalore,Food and Beverage startup focussing on developing products using ayurveda with modern science for women empowerment and fitness.,Food & Beverages,2018,2016,unknown,unknown,2
69,Enakshi,Seed,1000000.0,Ahmedabad,Enakshi is an online apparel brand for women.,Lifestyle,2018,2016,unknown,unknown,2
70,Ultraviolette Automotive,Series A,1000000.0,Bangalore,Ultraviolette is a startup working on electric two-wheelers and energy infrastructure.,Engineering,2018,2016,unknown,unknown,2
71,Inthree Access,Series A,4000000.0,Chennai,Inthree Access is an impact venture that connects the most inaccessible rural markets with products that can transform lives in Rural India.,Retail,2018,2016,unknown,unknown,2
72,BUGWORKS Research India,Series A,9000000.0,Bangalore,BUGWORKS is a drug discovery company.,Healthcare,2018,2016,unknown,unknown,2
73,Guardian.in,Seed,1000000.0,Mumbai,GNC is a leading global specialty retailer of health and wellness products that takes pride to be the world's largest company,Healthcare,2018,2016,unknown,unknown,2
74,PrestLoans,Seed,100000.0,New Delhi,"PrestLoans New age tech driven RBI regd NBFC helping businesses by providing easy, quick n hassle free loans.",Finance,2018,2016,unknown,unknown,2
75,Wimoxez,Seed,20000.0,Hyderabad,"Data Intelligence Publishing Platform, We bring the best resources to learn valuable technologies which will shape tomorrow.",Technology,2018,2016,unknown,unknown,2
76,India Accelerator,Angel,1000000.0,Gurgaon,India Accelerator runs mentorship-driven incubation and acceleration programs for start ups.,Services,2018,2016,unknown,unknown,2
77,HappyEMI,Seed,1000000.0,Bangalore,HappyEMI is a point of sale digital lending platform that helps consumers finance their purchases in-store and online,Finance,2018,2016,unknown,unknown,2
78,Wishup,Seed,1000000.0,Azadpur,Premium Personal Assistance service,Technology,2018,2016,unknown,unknown,2
79,Hansel.io,Series A,4000000.0,Bangalore,"Hansel, a mobile app management platform, provides the infrastructure that companies need, in order to personalize product experiences.",Technology,2018,2016,unknown,unknown,2
80,Propelld,Seed,250000.0,Bangalore,Propelld is a student education financing platform.,Finance,2018,2016,unknown,unknown,2
81,PivotRoots,Series A,1000000.0,Mumbai,Digital Marketing powered by Data & Technology; fueled by Design thinking,E-commerce,2018,2016,unknown,unknown,2
82,ZiffyHomes,Seed,120000.0,New Delhi,ZiffyHomes is a technology driven marketplace to find out home on rent.,Real Estate,2018,2016,unknown,unknown,2
83,Carmesi,Seed,1000000.0,Gurgaon,Carmesi is a brand of high-end menstrual-hygiene products in India.,Healthcare,2018,2016,unknown,unknown,2
84,OckyPocky,Angel,1000000.0,Haryana,OckyPocky is a interactive and personalised language learning app for preschool kids.,Education,2018,2016,unknown,unknown,2
85,Racetrack,Seed,1000000.0,Bangalore,"Racetrack is a sales and support-focused AI-driven platform designed for education, real estate, and e-commerce sectors.",Technology,2018,2016,unknown,unknown,2
86,WHR,Seed,143145.0,Pune,"WHR is to make affordable healthcare a reality for all. Our vision is to make healthcare services easier, better and more accessible.",Healthcare,2018,2016,unknown,unknown,2
87,Asteria Aerospace,Seed,1000000.0,Bangalore,Asteria Aerospace is a robotics and artificial intelligence company.,Engineering,2018,2016,unknown,unknown,2
88,FabAlley,Series B,1000000.0,Noida,"FabAlley is the ultimate Indian fashion destination for fashion-forward, indie-chic girls. Founded in 2012, Tanvi Malik and Shivani Poddar",Lifestyle,2018,2016,unknown,unknown,2
89,Tranzmeo,Pre-Seed,1000000.0,Cochin,Tranzmeo Connect : is A Complete Comprehensive Anomaly forensic Solution with Actionable Insights.,Technology,2018,2016,unknown,unknown,2
91,Studds Accessories,Equity,1000000.0,Faridabad,Studds Accessories is a scooter accessories service provider in India,E-commerce,2018,2016,unknown,unknown,2
92,Design Cafe,Series B,1000000.0,Bangalore,"Design + Execution Organization that delivers beautiful & innovative designs for Home Interiors, in any budget.",Real Estate,2018,2016,unknown,unknown,2
93,NoPaperForms Solutions Pvt. Ltd.,Series B,3980000.0,New Delhi,"NoPaperForms is a marketing automation, lead nurture and enrolment management platform for educational institutions",Education,2018,2016,unknown,unknown,2
94,Rays Power Infra,Unknown,1000000.0,Jaipur,Rays Power Infra is a leading integrated Solar Power Company.,Energy,2018,2016,unknown,unknown,2
95,AuthMetrik,Grant,10000.0,Gurgaon,"SaaS, B2B, Security, Stop account sharing, Fraud Detection",Technology,2018,2016,unknown,unknown,2
96,Khidki,Seed,1000000.0,Bangalore,Vernacular Social Network Focused on Town Level Content and Interactions,Technology,2018,2016,unknown,unknown,2
97,LetsTransport,Series B,1000000.0,Bangalore,Lets transport is a logistics solution provider.,Transportation & Logistics,2018,2016,unknown,unknown,2
98,Next Digital Solutions,Angel,1000000.0,Kota,Next Digital Solutions is website design & Digital Marketing development company.,E-commerce,2018,2016,unknown,unknown,2
99,Portea Medical,Debt Financing,1000000.0,Bangalore,Portea Medical is the largest and fastest growing provider of in-home medical care in India today with a 24-city network.,Healthcare,2018,2016,unknown,unknown,2
100,Aavas Financiers,Debt Financing,1000000.0,Jaipur,"Aavas Financiers is engaged in the business of providing housing loans, primarily in the un-served, unreached and under-served market.",Finance,2018,2016,unknown,unknown,2
102,Milkbasket,Series A,7000000.0,Haryana,"Milkbasket delivers milk, bread, eggs, butter, juices and other daily need items, every morning, right at your doorstep, free of charge.",Food & Beverages,2018,2016,unknown,unknown,2
103,Nutrisattva (Proliva),Angel,1000000.0,Anand,Nutrisattva is a protein innovation compan,Food & Beverages,2018,2016,unknown,unknown,2
105,Jagaran Microfin,Debt Financing,1000000.0,Kolkata,Jagaran Microfin is a Microfinance institution which achieves a healthy amalgamation of social and financial,Technology,2018,2016,unknown,unknown,2
107,Be U Salons,Seed,1000000.0,New Delhi,Be U is India's first subscription based Salon Chain.,Lifestyle,2018,2016,unknown,unknown,2
108,Impact Guru,Series A,2000000.0,Mumbai,"We're a Harvard incubated crowdfunding platform for nonprofits, social enterprises, startups and individuals.",Services,2018,2016,unknown,unknown,2
109,MobiKwik,Later Stage,1000000.0,Gurgaon,MobiKwik is a payments backed fintech platform in India. MobiKwik App offers instant loans & investment products to the 500M masses of India,Finance,2018,2016,unknown,unknown,2
110,Stones2Milestones,Seed,1000000.0,Gurgaon,Stones2milestones is a Gurgaon Based Learning Company.,Education,2018,2016,unknown,unknown,2
111,Generico,Series A,1000000.0,Mumbai,Generico is the fastest growing specialized pharmacy retail chain of Generic medicines.,Healthcare,2018,2016,unknown,unknown,2
112,Adiuvo Diagnostics,Seed,1000000.0,Chennai,Adiuvo Diagnostics is a medical diagnostic device company based in India.,Healthcare,2018,2016,unknown,unknown,2
113,DataTrained,Seed,1000000.0,Bangalore,"DataTrained is a educational platform, which operates an ed-tech startup on data science",Education,2018,2016,unknown,unknown,2
114,OneAssist,Debt Financing,2400000.0,Mumbai,OneAssist is a protection & assistance services platform.,Technology,2018,2016,unknown,unknown,2
116,APAC Financial Services,Equity,1000000.0,Mumbai,APAC Financial Services is a financial services platform.,Finance,2018,2016,unknown,unknown,2
118,SEDEMAC Mechatronics,Unknown,1000000.0,Mumbai,SEDEMAC Mechatronics is technology company that distributes control-intensive products for automobiles.,Engineering,2018,2016,unknown,unknown,2
119,MadGuy Labs,Unknown,150000.0,Hyderabad,MadGuy Labs is a Online Test-prep Platform.,Education,2018,2016,unknown,unknown,2
120,Dee Dee Labs,Seed,1000000.0,Pune,Dee Dee Labs is design and development lab with a primary focus on the development of next generation of bionic prostheses.,Healthcare,2018,2016,unknown,unknown,2
121,FLEECA,Seed,1000000.0,Jaipur,FLEECA is a Tyre Care Provider company.,Technology,2018,2016,unknown,unknown,2
122,Shop101,Series B,11000000.0,Mumbai,#1 Online Selling App. India’s leading social commerce platform. Setup free online store in 2 min. Sell own goods or resell Shop101 Supply.,E-commerce,2018,2016,unknown,unknown,2
123,FeedMyPockets,Seed,1000000.0,Bangalore,On Demand Staffing Platform,E-commerce,2018,2016,unknown,unknown,2
124,Housejoy,Series B,3240000.0,Bangalore,Housejoy is a web-based platform that allows individuals to browse and book service providers for their homes.,Lifestyle,2018,2016,unknown,unknown,2
125,Ambee,Angel,1000000.0,Bangalore,Ambee is an Environment analytics startup.,Healthcare,2018,2016,unknown,unknown,2
126,FoodBuddy,Seed,1000000.0,Belgaum,"FoodBuddy is a online food delivery portal, providing boundary breaking delivery.",Transportation & Logistics,2018,2016,unknown,unknown,2
127,Ninjacart,Series B,1000000.0,Bangalore,Ninjacart is a B2B agri-marketing platform that connects vegetables and fruits farmers directly with businesses.,Agriculture,2018,2016,unknown,unknown,2
128,Olly Smart Credit Card,Seed,1000000.0,New Delhi,Olly is a digital credit card for India's working masses and young people.,Finance,2018,2016,unknown,unknown,2
129,Zestl,Seed,1000000.0,Pune,"No-Code Workflow Automation. Build enterprise applications in days with AI, Cognitive Automation, Collaboration and more built in.",Technology,2018,2016,unknown,unknown,2
131,Wakefit,Unknown,1000000.0,Bangalore,Wakefitkart is a mattress manufacturing company. We manufacture the best quality mattresses at affordable prices.,Retail,2018,2016,unknown,unknown,2
132,Hero Electric,Unknown,1000000.0,New Delhi,"Hero Electric, a 100% subsidiary of the Hero Group, is a pioneer in the Indian Electric Vehicle Industry.",Retail,2018,2016,unknown,unknown,2
133,Pentation Analytics,Seed,1000000.0,Mumbai,Pentation as an Insurtech enables insurers and intermediaries with our Insurance Analytics Suite- an Insurance specific AI/ML Software Suite,Finance,2018,2016,unknown,unknown,2
134,PerkFinance,Seed,900000.0,Bangalore,PerkFinance partners with employers to provide affordable loans to their employees at no cost to the company,Finance,2018,2016,unknown,unknown,2
135,Roposo,Series C,10000000.0,Gurgaon,Roposo - TV by the People is a unique social media platform where people express visually with homemade videos and photos.,Media & Entertainment,2018,2016,unknown,unknown,2
136,Plum Goodness,Series A,1000000.0,Thane,Plum Haircare Is Silicone-Free & Sulphate-Free. Designed For Damaged & Dandruff-Free Hair,Lifestyle,2018,2016,unknown,unknown,2
137,Drstore,Seed,1000000.0,Mumbai,Drstore is a exclusive e- commerce platform.,Healthcare,2018,2016,unknown,unknown,2
138,Wow Venue,Unknown,1500000.0,Mumbai,Wow Venue is an online platform.,Hospitality,2018,2016,unknown,unknown,2
139,Chizel,Seed,1000000.0,Pune,Chizel is a worlds most advanced cloud platform for on-demand manufacturing in 3D Printing and CNC Machining,Manufacturing,2018,2016,unknown,unknown,2
140,OTO Capital,Seed,1000000.0,Mumbai,OTO Capital is a platform that allows you to own a car faster than ever.,Engineering,2018,2016,unknown,unknown,2
141,Boodmo,Seed,1000000.0,Gurgaon,boodmo.com - large online marketplace for auto parts in India.,Retail,2018,2016,unknown,unknown,2
142,Khabri,Seed,1000000.0,Haryana,Khabri is a digital audio platform for content in vernacular.,Media & Entertainment,2018,2016,unknown,unknown,2
143,MyNewCar.in,Unknown,1000000.0,Gurgaon,MyNewCar.in offers new cars at best price with great deals. Book a new car online or request a doorstep test drive,Engineering,2018,2016,unknown,unknown,2
144,HalaPlay Technologies,Series A,5000000.0,Bangalore,A daily fantasy sports platform.,Media & Entertainment,2018,2016,unknown,unknown,2
145,PlanetSpark,Seed,1000000.0,Gurgaon,PlanetSpark is an after-school Maths and English learning program for pre teen kids between Grades 2nd to 7th.,Education,2018,2016,unknown,unknown,2
146,WheelsEMI,Series B,14000000.0,Pune,"WheelsEMI is the brand name of NBFC, WheelsEMI Pvt. Ltd.",Technology,2018,2016,unknown,unknown,2
147,Forum for Innovation Incubation Research and Entrepreneurship,Grant,1000000.0,Margão,"FiiRE, a technology business incubator helps the startup process to move from the garage to the lab.",Services,2018,2016,unknown,unknown,2
149,Quikr,Debt Financing,1000000.0,Bangalore,"Quikr is a free classifieds and online marketplace that helps users sell, buy, rent, or discover anything across India.",Real Estate,2018,2016,unknown,unknown,2
150,Tabono,Seed,1000000.0,Gurgaon,Tabono is a one stop environment for all your fitness solution.,Sports,2018,2016,unknown,unknown,2
151,LearnApp,Seed,1000000.0,Noida,"Learnapp.co - Video courses & live classes in investing, trading, banking and finance.",Education,2018,2016,unknown,unknown,2
152,Shopkirana,Unknown,2000000.0,Indore,Shopkirana connects brands and traditional retailers with the help of technology and supply chain innovation.,Technology,2018,2016,unknown,unknown,2
153,Fric Bergen,Unknown,1000000.0,Alwar,Fric Bergen is a leader in the specialty food industry.,Technology,2018,2016,unknown,unknown,2
154,Articbot,Grant,1000000.0,Kannur,Articbot is a conversational AI platform for automated customer support and lead generation,Technology,2018,2016,unknown,unknown,2
155,BuildSupply,Series A,1000000.0,Gurgaon,India’s most advanced ERP system for the real estate,Real Estate,2018,2016,unknown,unknown,2
156,Fusion Microfinance,Later Stage,1000000.0,New Delhi,Fusion Microfinance Pvt. Ltd. is an NBFC registered with RBI,Finance,2018,2016,unknown,unknown,2
157,Any time Doctor,Angel,1000000.0,Chennai,Anytime Doctor is a Software company.,Technology,2018,2016,unknown,unknown,2
158,Go Payments,Later Stage,1000000.0,Mumbai,Go Payments was founded with the mission of assisting consumers with performing a whole host of financial services at their doorstep.,Technology,2018,2016,unknown,unknown,2
159,Guiddoo World,Seed,800000.0,Mumbai,We build In-Destination Experiences!,Transportation & Logistics,2018,2016,unknown,unknown,2
160,ION Energy,Unknown,1041000.0,Mumbai,A stealth startup building a layer of infrastructure for highly efficient energy storage systems.,Energy,2018,2016,unknown,unknown,2
161,UnoTag,Pre-Seed,100000.0,Bangalore,SaaS to verify counterfeit,Technology,2018,2016,unknown,unknown,2
162,CivilCops,Pre-Seed,100000.0,Gurgaon,Gov-Tech,Technology,2018,2016,unknown,unknown,2
163,Rockmetric,Grant,1000000.0,Mumbai,"Smarter analytics to understand how each customer uses your product. Drive growth in conversion, retention and engagement.",Technology,2018,2016,unknown,unknown,2
164,Classworks India,Unknown,1000000.0,Chennai,"Saas, Web App, Mobile App, School Education",Technology,2018,2016,unknown,unknown,2
165,Snapmint,Seed,1000000.0,Mumbai,"Snapmint facilitates simplified, fairly-priced and hassle-free EMI options without a Credit Card.",Finance,2018,2016,unknown,unknown,2
