,Company/Brand,Stage,Amount($),HeadQuarter,What_it_does,Sector,Funding_Year,Founded,Founders,Investor,Startup_Age
1435,Zealthy,Seed,3000000.0,Bangalore,"It connects women to healthproviders for specialities like infertility, maternity etc.,",Health,2020,2019,"Rishi Malhotra, Akhil Gupta","KYT Ventures, First Cheque, AngelList",1
1436,CoinDCX,Series A,3000000.0,Bangalore,A cryptocurrency trading platform,Finance,2020,2016,Sumit Gupta,"Polychain Capital, Bain Capital Ventures, HDR Group",4
1437,NuNu TV,Unknown,670000.0,Bangalore,Kids-focussed Youtube channel,Media & Entertainment,2020,2016,unknown,Risers Accelerators,4
1438,QTalk,Seed,1600000.0,Bangalore,Smart Phone Dialer,Technology,2020,2016,"Sagar Modi, Advaith Vishwanath","Accel India, Lightspeed Venture Partners",4
1439,Shadez,Seed,100000.0,Mumbai,Paint Company,Lifestyle,2020,2018,"Adarsh Anand, Amit Tiwari",Inflection Point Ventures,2
1440,Excess2Sell,Unknown,1000000.0,Mumbai,B2B Marketplace for Overstock & Surplus Inventory,E-commerce,2020,2016,Rajan Sharma,Gautham Madhavan,4
1441,Stanplus,Pre-Seed,1500000.0,Hyderabad,Ambulance service,Health,2020,2016,Prabhdeep Singh,Pegasus FinInvest,4
1442,Pitstop,Series A,2500000.0,Bangalore,Doorstep car service,Manufacturing,2020,2016,Mihir Mohan mishra,TPG-backed Group Landmark,4
1443,Univariety,Unknown,1100000.0,Hyderabad,Online marketplace that provides career counselling and college guidance,Education,2020,2015,Jaideep Gupta,Info Edge,5
1444,Peel Works,Later Stage,3000000.0,Mumbai,E-commerce for corner/retail stores.,Technology,2020,2010,"Sachin Chhabra, Nidhi Ramachandran",CESC Ventures,10
1445,CoreStack,Series A,8500000.0,Chennai,Enterprise cloud governance technology startup,Technology,2020,2016,"Ezhilarasan Natarajan, Sabapathy Arumugam, Krishnakumar Narayanan, Thiruvalluvar NB",Naya Ventures,4
1447,Agnikul,Pre-Seed,3148000.0,Chennai,"It designs, fabricates, tests and launch orbital class launch vehicles",Engineering,2020,2016,Srinath Ravichandran,pi Ventures,4
1448,Fintso,Unknown,2600000.0,Bangalore,Wealth management platform,Finance,2020,2020,"George Mitra, Rajan Pathak","Rajeev Juneja, Pratul Shroff, Dilip Khandelwal, Piyush Gupta",0
1449,Khatabook,Unknown,3000000.0,Bangalore,It helps SMEs to maintain their accounts and ledger online.,Finance,2020,2016,Ravish Naresh,Mahendra Singh Dhoni,4
1450,Smart Coin,Series A,7000000.0,Bangalore,Consumer lending startup,Finance,2020,2015,"Amit Chandel, Rohit Garg, Vinay Kumar, Jayant Upadhyay",LGT LightstoneAspada,5
1451,ZunRoof,Series A,3000000.0,Gurugram,"It specialises in solar rooftop design, installation, and management using technology",Health,2020,2016,"Pranesh Chaudhary, Sushant Sachan",Godrej Investments,4
1452,Shop101,Series C,3900000.0,Bangalore,Enables entrepreneurs to sell online,E-commerce,2020,2015,"Abhinav Jain, Aditya Gupta","Stellaris Venture Partners, Unilever Ventures, Kalaari Capital, Vy Capital",5
1453,OM Bhakti,Seed,3000000.0,Bangalore,A puja cotton-wicks manufacturing startup,Retail,2020,2016,"Sridhar Joshi, Prashant Kulkarni",Venture Catalysts,4
1454,Lal10,Unknown,1100000.0,Uttar Pradesh,It helps Indian artisans and SMEs reach out to global retailers,Services,2020,2016,"Maneet Gohil, Sanchit Govil, Albin Jose",Sorenson Impact,4
1455,Anaxee Digital Runner,Unknown,3000000.0,Indore,A tech-enabled ID verification and data collection startup,Technology,2020,2016,"Govind Agrawal, Arti Agrawal",Orios Venture Partners,4
1456,CollegeKhabri,Unknown,3000000.0,Bhopal,Platform is an end-to-end college and career counselling platform for students,Education,2020,2019,Arshi Khan,Vishal Dixit,1
1457,Ola Electric,Unknown,1000000.0,Bangalore,Electric vehicle,Transportation & Logistics,2020,2016,"Ankit Jain, Anand Shah",Pawan Munjal Family Trust Fund,4
1458,Multi Living,Unknown,6000000.0,Mumbai,"It curates apartments from the homeowners, performs the quality check and offers the homes with built-in services to the potential tenants",Real Estate,2020,2016,Pankaj Singh,Lodha Ventures,4
1459,FamPay,Seed,4700000.0,Bangalore,"It allows parents to send money to their kids below the age of 18, which they can spend securely under parent supervision.",Finance,2020,2016,Kush Taneja,"Y Combinator, Venture Highway, Sequoia India, Global Founders Capital",4
1460,UnboxRobotics Labs,Seed,500000.0,Bangalore,Automated flexible parcel sorting solutions for logistics providers,Technology,2020,2016,Pramod Ghadge,"Arali Ventures, CIIE.CO",4
1461,Karbon Card,Seed,2000000.0,Bangalore,Specialisde corporate cards for startups,Finance,2020,2016,"Pei-fu Hsieh, Amit Jangir","Kunal Shah, Amrish Rau, Jitendra Gupta",4
1462,Airmeet,Unknown,3000000.0,Bangalore,"A platform to host, discover, and attend fully remote events like conferences and professional meet-ups",Media & Entertainment,2020,2016,"Lalit Mangal, Vinay Jaasti, Manoj Singh",Accel India,4
1463,Innerchef,Unknown,1000000.0,Gurgaon,Cloud kitchen platform,Food & Beverages,2020,2016,Rajesh,Mistletoe,4
1464,Epigamia,Series C,3000000.0,Mumbai,Flavoured and greek yoghurt brand,Retail,2020,2015,Rohan Mirchandani,KA Enterprise,5
1465,StyleNook,Unknown,3000000.0,Mumbai,Marketplace for fashionable apparel,E-commerce,2020,2016,Lathika Pai,"Lead Angels Network, Stanford Angels",4
1466,Callido Learning,Unknown,3000000.0,Mumbai,Provides a structured educational approach to critical thinking and problem solving skills,Education,2020,2016,Sriram Subramanian,Education Catalyst Fund,4
1467,Soxytoes,Unknown,3000000.0,Delhi,Online store to buy various types of socks including funky and colorful socks,E-commerce,2020,2016,"Vidushi Kajaria, Aayush Goenka",Angel network,4
1468,F5,Seed,3000000.0,Delhi,Retail Aggregator,E-commerce,2020,2018,"Raghav Arora, Lalit Kumar Aggarwal",LetsVenture investors,2
1469,Paper Boat,Unknown,4049500.0,Bangalore,Ecommerce platform for beverages and snacks,Food & Beverages,2020,2013,"Neeraj Kakkar, James Nutall, Suhas Misra, Neeraj Biyani","Advent Management, A91 Emerging Fund, Trifecta Venture",7
1470,Strata,Seed,1500000.0,Bangalore,Real estate investment platform,Technology,2020,2019,"Sudarshan Lodha, Priyanka Rathore","SAIF Partners, Mayfield India",1
1471,Salesken,Series A,8000000.0,Bangalore,Provides sales professionals with intelligence on various aspects of the sales pitch,Technology,2020,2016,"Sreeraman Vaidyanathan, Surga Thilakan",Sequoia Capital India,4
1472,Arya,Series B,6000000.0,Noida,Provides post-harvest services across the agricultural value chain,Agriculture,2020,2016,Prasanna Rao,LGT Lightstone Aspada,4
1473,Leap Finance,Unknown,5500000.0,Bangalore,Provides education loans to students based on the student’s future income,Finance,2020,2016,"Vaibhav Singh, Arnav Kumar",Sequoia Capital India,4
1474,Sleepy Owl,Unknown,3000000.0,Delhi,"It sells ready to drink cold brew coffees, brew boxes and packs.",Food & Beverages,2020,2016,"Ajai Thandi, Arman Sood, Ashwajeet Singh",Rukam Capital,4
1475,Tricog,Series B,10500000.0,Bangalore,Provides virtual cardiology services through its AI-powered healthcare platforms,Health,2020,2015,"Charit Bhograj, Zainul Charbiwala, Udayan Dasgupta, Abhinav Gujjar","UTEC-The University of Tokyo Edge Capital, Aflac Ventures, LLC, Dream Incubator, TeamFund",5
1476,GogoBus,Unknown,3000000.0,Delhi,Inter-City Mobility Startup,Transportation & Logistics,2020,2016,Amit Gupta,Ixigo,4
1477,Trell,Pre-Seed,4000000.0,Bangalore,Allows users to share their travel experiences,E-commerce,2020,2016,"Pulkit Agrawal, Prashant Sachan, Arun Lodhi, Bimal Kartheek Rebba, Nirav Sheth","Sequoia’s Surge, Fosun RZ",4
1478,Spaciya Consultants,Pre-Seed,500000.0,Noida,Real estate consultancy firms,Real Estate,2020,2016,Ajit Panda,Alok Garg,4
1479,Bounce,Unknown,6500000.0,Bangalore,Offers a variety of bikes and scooters that can be rented on a subscription basis,Services,2020,2014,"Vivekananda Hallekere, Anil Giri Raju, Arun Agni",InnoVen Capital,6
1480,Neeman,Pre-Seed,1000000.0,Bangalore,An eco-conscious footwear brand making comfortable shoes using Merino Wool,E-commerce,2020,2017,"Taran Chhabra, Amar Preet Singh",Anicut Angel Fund,3
1481,Chqbook,Series A,5000000.0,Gurugram,"Marketplace for small business owners, offering them products around lending, credit cards etc",Finance,2020,2017,"Vipul Sharma, Rajat Kumar, Sachin Arora, Mohit Goel",Aavishkaar Capital,3
1483,Oda Class,Pre-Seed,3000000.0,Bangalore,"It offers content and material via video, adopting a dual-teacher model with IIT and NIT alumni",Education,2020,2016,"Li Yong, Shushant Srivastava",Yuanfudao,4
1485,goStops,Unknown,3000000.0,Delhi,A premium chain of youth hostels catering to the millennials,Accomodation,2020,2012,"Pallavi Agarwal, Pankaj Parwanda",Atraxn Partners.,8
1488,Flick Stree,Series A,3000000.0,Mumbai,Artificial intelligence-based video publishing network,Media & Entertainment,2020,2016,Saurabh Singh,Samsung Venture Investment,4
1489,Qure ai,Unknown,16000000.0,Mumbai,Provides interpretations of radiology scans,Health,2020,2016,"Prashant Warier, Pooja Rao",Sequoia Capital India,4
1490,MinionLabs,Unknown,3000000.0,Bangalore,It leverages a Machine Learning-based approach to generate a comprehensive report on predictive analytics,Technology,2020,2016,Gokul Shrinivas,Indian Angel Network,4
1491,Josh Talks,Pre-Seed,1500000.0,Haryana,Community of young individuals providing a platform to showcase their stories,Media & Entertainment,2020,2015,"Supriya Paul, Shobhit Banga",Media Development Investment Fund,5
1492,PhoneParLoan,Unknown,3000000.0,Delhi,Provides easy loans,Finance,2020,2015,Ringaile Noq,Accelerator MOX,5
1493,RailYatri,Unknown,13800000.0,Noida,A complete Indian railways app,Lifestyle,2020,2011,"Manish Rathi, Kapil Raizada, Sachin Saxena","Nandan Nilekani, Samsung Venture Investment Corporation",9
1494,AjnaLens,Pre-Seed,1500000.0,Thane,"It leverages technologies such as AR, VR & AI to offer hardware in areas such as education and defence",Technology,2020,2014,"Pankaj Raut, Abhishek Tomar, Abhijit Patil","Maharashtra Defence, Aerospace Venture Fund (MDAVF)",6
1495,Pepper,Seed,306900.0,Mumbai,End to end content creation platform,E-commerce,2020,2017,Anirudh Singla and Rishabh Shekhar,"Kunal Bahl, Rohit Bansal",3
1499,Invideo,Unknown,2500000.0,Bangalore,Video production and editing platform,Media & Entertainment,2020,2016,Sanket Shah,Sequoia Capital’s Surge,4
1500,AvalonMeta,Unknown,420000.0,Bangalore,It combines higher education and competitive gaming,Education,2020,2017,"Varun Mayya, Shashank Udupa, Abhinav Arora",Peerplays,3
1501,Near Store,Seed,300000.0,Mumbai,Enables a shop to create an online presence,E-commerce,2020,2016,unknown,Sauce.vc,4
1502,ElecTorq,Unknown,3000000.0,Delhi,Electric vehicle startup,Manufacturing,2020,2016,Anubhav Sharma,AdvantEdge,4
1503,Prayaan Capital,Seed,1200000.0,Chennai,"NBFC that lends to micro, small, and medium-sized enterprises (MSMEs)",Finance,2020,2016,"Madhan Mohan , Akash Chelvam",Accion Venture Lab,4
1504,Sanfe,Pre-Seed,1100000.0,Delhi,Women health care and wellness product,Health,2020,2016,"Archit Agarwal, Harry Sehrawat","SucSEED Venture Partners, BIRAC, Elixir Pharma, Titan Capital",4
1505,Go Desi,Seed,627300.0,Delhi,Provides traditional delicacies,Food & Beverages,2020,2018,Vinay Kothari,Rukam Capital,2
1509,Zvesta,Unknown,5500000.0,Gurugram,An online platform where users can search and buy properties listed by developers and brokers,Technology,2020,2015,"Rajan Dang, Anushree Srivastava",Hindustan Media Ventures,5
1510,Dunzo,Unknown,11000000.0,Bangalore,India-based hyperlocal delivery startup,Transportation & Logistics,2020,2014,Kabeer Biswas,Alteria Capital,6
1511,Digit Insurance,Unknown,340000.0,Bangalore,General Insurance Company,Finance,2020,2016,Kamesh Goyal,"Virat Kohli, Anushka Sharma",4
1512,Yolo,Seed,600000.0,Gurugram,Intercity transportation,Transportation & Logistics,2020,2019,"Shailesh Gupta, Mukul Shah, Danish Chopra",unknown,1
1513,SmartVizX,Pre-Seed,1397000.0,Bangalore,It developed India’s first VR-based design communication and collaboration product Trezi,Technology,2020,2015,"Tithi Tewari, Gautam Tewari",Rockstud Capital,5
1514,MaxWholesale,Series A,3000000.0,Delhi,B2B ecommerce platform for kirana stores,E-commerce,2020,2016,Samarth Agrawal,"IAN Fund-I,  Al Falaj Investment Company (AFI)",4
1515,Carbon Clean,Unknown,16000000.0,Bangalore,Develops affordable carbon capture technology,Health,2020,2009,"Aniruddha Sharma, Prateek Bumb","WAVE Equity Partners, Chevron Technology Ventures, Marubeni Corporation.",11
1517,Genius Corner,Unknown,250000.0,Noida,Framework to enable personalised learning using artificial intelligence (AI) and machine learning (ML).,Education,2020,2014,"Vishal Khatter, Dheeraj Khatter, Dipak Varshney","Mahesh Mohta, Jyoti Arora, Nachu Subramanian, Srivats",6
1518,PlanetSpark,Unknown,448500.0,Gurugram,Provides neighbourhood learning zones where children learn and develop 'new-age' skills under one roof,Education,2020,2016,"Maneesh Dhooper, Kunal Malik","Indian Angel Network, Lead Angels, Hyderabad Angels",4
1519,CamCom,Unknown,3000000.0,Bangalore,AI automation platform for enterprise quality control,Technology,2020,2017,"Ajith Nayar, Umesh, Mahesh Subramanian","Triton Investment Advisors,",3
1520,Simsim,Series B,8000000.0,Bangalore,It enables community opinion influencers to sell products to thousands of micro-communities in India,E-commerce,2020,2016,Amit Bagaria,"Accel Partners, Shunwei Capital, Good Capital",4
1521,Shuttl,Series C,7975700.0,Delhi,App based bus aggregator serice,Transportation & Logistics,2020,2015,"Amit Singh, Deepanshu Malviya",SIG Global India Fund,5
1522,HooLiv,Unknown,3000000.0,Delhi,Student Co-living startup,Accomodation,2020,2016,"Chinmoy Mishra, Gaurav Vij, and Abhishek Verma",Kolte-Patil Family Office,4
1523,ClassMonitor,Unknown,3000000.0,Indore,The learning platform that blends curriculum-based activities for children,Education,2020,2016,"Vijeet Pandey, Vikas Rishishwar",Ashwin Khorana,4
1524,Friyey,Unknown,3000000.0,Pune,Co working space startup,Real Estate,2020,2016,Yogesh Thore,Tarun Bhalla,4
1525,Oga,Unknown,330000.0,Bangalore,Provides interactive fitness experience to people across the world,Lifestyle,2020,2016,Ashish Rawat,Inflection Point Ventures,4
1526,Big Basket,Unknown,3500000.0,Bangalore,Online grocery store,E-commerce,2020,2016,"Abhinay Choudhari, Hari Menon, Vipul Parekh, VS Sudhakar",Trifecta Capital,4
1527,CYFIRMA,Series A,3000000.0,Bangalore,Offer cybersecurity services,Technology,2020,2016,Ritesh Kumar,Z3 Partners,4
1528,Innoviti,Unknown,5000000.0,Bangalore,Digital payments solutions company,Finance,2020,2016,Rajeev Agrawal,FMO,4
1529,Paytm money,Unknown,5600000.0,Bangalore,Wealth Management,Finance,2020,2010,Vijay Shekhar Sharma,One97 Communications,10
1531,Yap,Unknown,1402000.0,Chennai,Banking and payment products-focused API platform,Finance,2020,2016,"Madhusudanan R, Muthukumar and Prabhu","Amrish Rau, Kunal Shah, Jitendra Gupta",4
1532,Clover,Series A,5500000.0,Bangalore,Provides agricultural solution to farmers working in the greenhouse production of vegetables and fruits,Agriculture,2020,2016,"Avinash BR, Gururaj Rao, Arvind Murali, Santhosh Narasipura","Omnivore, Accel Partners, Mayfield",4
1534,CodingNinjas,Series A,5200000.0,Delhi,Online learning platform,Education,2020,2016,"Singla, Kannu Mittal, Dhawal Parate",Info Edge Ltd,4
1535,Furlenco,Series C,2200000.0,Bangalore,Furniture rental startup,E-commerce,2020,2011,Ajith Mohan Karimpana,Chowdry Associates,9
1536,Brick&Bolt,Pre-Seed,1500000.0,Bangalore,Operates in the residential construction space,Finance,2020,2018,"Jayesh Rajpurohit, Arpit Rajpurohit",Surge,2
1537,HempStreet,Pre-Seed,1000000.0,Bangalore,Manufacturer of ayurvedic medicines based on cannabis,Health,2020,2019,Abhishek Mohan,Pharmacon Holdings,1
1539,Classplus,Pre-Seed,2500000.0,Bangalore,It allows coaching centres to take their brick-and-mortar setup online,Education,2020,2018,"Rustagi, Bhaswat Agarwal","Blume Ventures, Sequoia",2
1541,PetPooja,Unknown,2000000.0,Ahmedabad,Restaurant management software provider,Technology,2020,2011,Apurv Patel,Udaan,9
1542,Altor,Unknown,3000000.0,Bangalore,Makes helmets that are IoT and AI enabled,Technology,2020,2016,"Shamik Guha, Sayan Tapadar, Muhammad Bilal Shakil, Anirban Datta Gupta",Venture Catalysts,4
1547,WorkIndia,Unknown,6000000.0,Bangalore,An online and mobile-based platform that connects companies with blue collar employees.,Human Resources,2020,2016,Kunal Patil,Xiaomi,4
1548,Qyuki,Unknown,3500000.0,Mumbai,Multi-channel broadcast network,Media & Entertainment,2020,2016,"AR Rahman, Shekhar Kapur",Info Edge Venture Fund,4
1550,Picxy,Unknown,250000.0,Hyderabad,Stock photo industry,Media & Entertainment,2020,2016,Jitendra Emmani,"FirstCheque, Angellist India, Aakrit Vaish, Ranjith Radhakrishnan",4
1551,Krimanshi,Unknown,20000.0,Jodhpur,Sustainable system to feed animals by valorizing food residues and surplus into highly nutritious feeds,Agriculture,2020,2016,Nikhil Bohra,Arunachal Pradesh Social Entrepreneurship Meet,4
1552,NEETprep,Unknown,3000000.0,Delhi,Provides crash course for NEET preparation,Education,2020,2016,Kapil Gupta,IndiaQuotient,4
1553,Dot Pvt. Ltd,Seed,8000000.0,Gurugram,It provides digital transformation and commerce solutions to brick and mortar outlets,Finance,2020,2016,Shailaz Nag,"PayU, Fosun RZ Capital",4
1554,Kuku FM,Series A,5500000.0,Mumbai,A podcast platform,Media & Entertainment,2020,2016,"Lal Chand Bisu, Vikas Goyal, Vinod Kumar Meena",Vertex Ventures,4
1555,SuperMoney,Pre-Seed,1000000.0,Mumbai,Provides financial tools for effective business making,Finance,2020,2018,Nikhil Banerjee,Unitus Ventures.,2
1556,Rebel Foods,Unknown,4900000.0,Bangalore,It runs internet kitchen,Food & Beverages,2020,2016,"Jaydeep Barman, Kallol Bannerjee",Alteria Capital,4
1557,AlphaVector,Unknown,3000000.0,Bangalore,It sells modern age bicycles named FROG,Technology,2020,2015,Sachin Chopra,"Avaana Capital, Titan Capital",5
1558,Fox Capital,Unknown,2500000.0,Jaipur,Digital lending startup,Finance,2020,2019,Rakesh Sharma,Institutional Investors,1
1559,Tribe Theory,Unknown,3500000.0,Bangalore,An entrepreneur-focused hostel chain present in multiple locations across the world.,Accomodation,2020,2016,Katie Russel and Daniel Wiegand,Tim Draper,4
1560,Fleetx,Series A,1402400.0,Bangalore,Fleet management and predictive analytics platform,Technology,2020,2016,"Vineet Sharma, Abhay Jeet Gupta, Udbhav Rai, Parveen Kataria, Vishal Misra",Beenext,4
1561,Embibe,Unknown,12618300.0,Mumbai,It provides AI-based data analytics to personalise learning outcomes,Education,2020,2016,Aditi Avasthi,Reliance Industries Limited (RIL),4
1562,Entri,Seed,1400000.0,Kochi,It is a app that provides different types of learning content in local languages,Education,2020,2017,"Mohammed Hisamuddin, Rahul Ramesh",Good Capital,3
1563,Oye! Rickshaw,Series A,10000000.0,Bangalore,App-based electric rickshaw hailing service,Transportation & Logistics,2020,2016,Akash Deep,Chiratae Ventures,4
1564,Seal Professional,Pre-Seed,3000000.0,Bangalore,Trains students in managemnt and leadership skills and also helps in placement,Education,2020,2012,unknown,Equanimity Ventures,8
1565,Sprinng Foods,Unknown,3000000.0,Mumbai,Provides Gluten-free food,Food & Beverages,2020,2016,Tarun Khanna,"Mistletoe, Info Edge Asia",4
1566,1MG,Unknown,9900000.0,Gurugram,Online pharmacy,Health,2020,2015,"Prashant Tandon, Gaurav Agarwal, Vikas Chauhan",Bill & Melinda Gates Foundation,5
1567,Aagey,Unknown,3000000.0,Bangalore,Provides financial assistance to MSMEs,Finance,2020,2016,Akaash Shankar,"JITO Angel Network, Ketan Kothari, Girish Jain, Sunil Singhvi, Vinay Jain",4
1568,Doubtnut,Series A,15000000.0,Gurugram,Multi-lingual digital solutions platform for students,Education,2020,2017,"Tanushri Nagori, Aditya Shankar",Tencent,3
1569,AdonMo,Unknown,3000000.0,Bangalore,It is an online and outdoor advertising company,Marketing and Advertising,2020,2017,"Sandeep Bommireddi, Sravanth Gajula",Ant Financial,3
1570,RACEnergy,Seed,3000000.0,Bangalore,It builds electric vehicles and supporting infrastructure,Transportation & Logistics,2020,2018,"Arun Sreyas, Gautham Maheswaran","GrowX ventures, Prophetic Ventures",2
1572,Kisan Network,Seed,3000000.0,Gurugram,Integrated supply chain for farmers to sell their produce directly to buyers,Agriculture,2020,2015,"Aditya Agarwalla, Sanjay Agarwalla",Atsushi Taira,5
1574,Yolo,Seed,600000.0,Gurugram,Intercity transportation startup,Transportation & Logistics,2020,2019,"Shailesh Gupta, Mukul Shah, Danish Chopra",unknown,1
1575,Unotech,Unknown,2000000.0,Mumbai,It develops fully-customisable open source software,Technology,2020,2011,Vikash Jha,Manish Choksi,9
1576,Zetwerk,Unknown,2200000.0,Bangalore,B2B marketplace that connects manufacturing companies for industrial equipements,Retail,2020,2018,"Amrit Acharya, Srinath Ramakkrushnan, Vishal Chaudhary",InnoVen capital,2
1577,CureSkin,Unknown,500000.0,Bangalore,Provides a treatment solution for skincare and hair fall issues with an artificial intelligence-enabled solution,Health,2020,2017,"Guna Kakulapati, Rama Rajanna, Charu Sharma",SenseAI Ventures,3
1578,WizKlub,Seed,982530.0,Bangalore,Helps students solve problems at complex level,Education,2020,2018,Amit Bansal,Incubate Fund India,2
1581,Uniplatform Tech,Unknown,3000000.0,Delhi,Runs real estate SaaS platform MultiplyMyLeads.com.,Technology,2020,2015,"Rohit Manghnani, Amit K Jaiswal, Iccha Manghnani","Frontline Strategy Finds, SucSEED Venture Partners LLP",5
1582,INdwealth,Series C,12000000.0,Gurugram,An Artificial Intelligence and Machine learning based wealth management platform,Finance,2020,2016,Ashish Kashyap,"Tiger Global, Steadview Capital, DF International Private Partners",4
1587,GetVantage,Seed,3000000.0,Mumbai,Revenue based finance provider,Finance,2020,2016,Bhavik Vasa,"Samyakth Capital, Venture Catalysts",4
1588,Konfinity,Unknown,3000000.0,Noida,Provides online coding courses,Education,2020,2018,"Navratn Singh, Kamal Pandey",Angel investors,2
1589,Pine Labs,Unknown,3000000.0,Noida,Retail payment and hardware company,Finance,2020,2016,"Lokvir Kapoor, Rajul Garg, Tarun Upaday",Mastercard,4
1590,Instoried,Unknown,3000000.0,Delhi,Augmented writing platform which improves customer interest and engagement.,Technology,2020,2016,Sharmin Ali,"SOSV, Chinaccelerator",4
1591,Nupay,Unknown,3000000.0,Haryana,"Integrated platform for Receivables and Payables automation, Electronic Invoicing, Reconciliations and Bank payouts",Finance,2020,2016,"Neeraj Singh, Alok Arora",Venture Catalysts,4
1593,Samosa Singh,Series A,2700000.0,Bangalore,Offers hygienic Indian Snacks,Food & Beverages,2020,2016,"Shikhar Veer Singh, Nidhi Singh",She Capital,4
1594,Crysta,Pre-Series,1403400.0,Delhi,Offers diagnostic and screening services with regular counselling and clinical data management,Health,2020,2018,unknown,"Green Shots Capital, Alfa Ventures, Real Time Venture, Petrotech, Steel City Securities, Lalit Wadhwa, Dr Kriti Maroli",2
1595,Eupheus Learning,Series A,4300000.0,New Delhi,"Provides technology-led, subscription-based learning solutions to schools",Education,2020,2017,"Sarvesh Shrivastava, Ved Prakash Khatri, Amit Kapoor",Yuj Ventures,3
1597,Park+,Unknown,11000000.0,Bangalore,It is engaged in bringing digitization in parking,Technology,2020,2016,Amit Lakhotia,"Sequoia Capital, Matrix Partners India",4
1598,Goodmylk,Seed,400000.0,Bangalore,Provides Vegan dairy products,Agriculture,2020,2017,Abhay Rangan,"Ginni International, Elisa Khong, Sandeep Singh, VegInvest",3
1599,SmartKarrot,Unknown,1000000.0,Bangalore,It tracks customers’ real-time digital behaviour,Technology,2020,2019,"Prithwi Dasgupta, Arnab Chatterjee",Angel investors,1
1601,Tea Trunk,Unknown,220000.0,Goa,Global premium tea brand,Food & Beverages,2020,2013,"Snigdha Manchanda, Vikas Kumar, Aishwarya Malhi",Angel investors,7
1603,Mera Cashier,Seed,250000.0,Noida,App meant for small and micro businessmen to manage their transactions digitally,Finance,2020,2019,"Suneel Kumar, Sucharita Reddy, Gaurav Tomar, Akhilesh Nigam,","Amit Singal, Manish Aggarwal",1
1604,Samya AI,Seed,6000000.0,Bangalore,Revenue growth AI startup in the consumer packed goods (CPG) space,Technology,2020,2019,"Shailendra Singh, Deepinder Dhingra, Pavan Palety",Sequoia Capital India,1
1605,Kristal AI,Series A,6000000.0,Bangalore,Provides Algorithm-based financial services,Technology,2020,2016,"Asheesh Chanda, Vineeth Narasimhan",Chiratae Ventures,4
1606,Invento Robotics,Seed,281300.0,Bangalore,Known for Mitra Series of Robots,Technology,2020,2016,"Balaji Viswanathan, Be Limitless Inc., Zingfin.com, NalandaU","Windrose Capital, ITI Growth Opportunities Venture Fund",4
1607,Zimyo,Unknown,3000000.0,Gurugram,Automates everyday HR processes with integrated solutions,Human Resources,2020,2018,"Kumar Mayank, Ajay Kadyan",Yatra Angel Network (YAN),2
1608,Sabse Sasta Dukaan,Unknown,3000000.0,Kolkata,Online pharmacy dealing in medicines,Health,2020,2016,"Anish Agarwal, Anant Jain",Angel investors,4
1609,Fitphilia,Unknown,3000000.0,Mumbai,Provides IoT-enabled treadmill,Health,2020,2016,Nirav Patil,Angel investors,4
1610,Medicus,Unknown,12700.0,Mumbai,AI-based platform that explains and interprets blood tests and medical reports,Health,2020,2016,"Bhavesh Shah, Manav Shah",Angel investors,4
1611,Monech,Seed,12700.0,Mumbai,Automated platform which will help users to take their financial decisions,Finance,2020,2016,unknown,Angel investors,4
1612,Teach Us,Seed,12700.0,Bangalore,Educational portal which enables the students to access information related to education at one common platform,Education,2020,2016,unknown,Angel investors,4
1613,Dealberg,Unknown,3000000.0,Bangalore,Deals in office supplies,E-commerce,2020,2016,Abhishek Emmanuel,unknown,4
1615,Extra Edge,Pre-Series,700000.0,Pune,Admission Marketing Automation software for the education industry,Education,2020,2016,Kavita Dhillon,"Sprout Venture Partners, Indian Angel Network",4
