,Company/Brand,Stage,Amount($),HeadQuarter,What_it_does,Sector,Funding_Year,Founded,Founders,Investor,Startup_Age
2215,Earth Rhythm,Seed,1200000.0,Gurugram,A mission to make customers healthier and Earth a little greener.,Lifestyle,2021,2020,Harini Sivakumar,Anicut Angel Fund,1
2216,Fountain9,Seed,1900000.0,Mumbai,"Fountain9 is a Y Combinator backed company, which offers predictive inventory planning and optimization software for e-commerce, DTC and retail companies.",Technology,2021,2019,"Niki Khokale, Rajas Lonkar","021 Capital, Y Combinator",2
2217,Rockclimber,Unknown,1000000.0,Bangalore,RockClimber is a new age beverage brand with a portfolio of alcoholic and non alcoholic drinks.,Food & Beverages,2021,2019,"Deepak Poduval, Hariprasad Shetty",Anand Prakash Sharma,2
2218,SpEd@home,Unknown,300000.0,Mumbai,"Provide Remediation, Occupational Therapy, Speech Therapy and Socio-emotional coaching for children with Learning Disabilities like Dyslexia, Dysgraphia, Dyscalculia",Education,2021,2020,Dhaval Mody,Inflection Point Ventures,1
2219,CanPe,Seed,3500000.0,Bangalore,"Digital-first debt collections platform that is driven by compassion, and powered by AI.",Technology,2021,2019,Arindam Choudhury,Axilor Ventures,2
2220,Green Soul,Unknown,200000.0,Ambernath,Green Soul is No.1 brand on Amazon India in Ergonomic chairs category in terms of customer reviews.,Retail,2021,2016,Ravi Khushwani,velocity.in,5
2224,Vahak,Pre-Series,5000000.0,Bangalore,Building India's Largest & Most Trusted Online Transport Marketplace & Directory,Transportation & Logistics,2021,2017,"Vikas Chandrawat, Karan Shaha",RTP Global,4
2225,goSTOPS,Pre-Series,1000000.0,New Delhi,goSTOPS aims to be India’s biggest and most loved backpacker hostel brand.,Hospitality,2021,2014,"Pallavi Agarwal, Pankaj Parwanda","IAN, Yuj Ventures",7
2226,Codedamn,Pre-Seed,3500000.0,New Delhi,Codedamn enables anyone to learn and practice real-world programming skills and become industry relevant through our learning paths.,Technology,2021,2020,Mehul Mohan,Antler India,1
2227,Biocraft Innovation Technology,Pre-Seed,3500000.0,Noida,Innovation startup developing bamboo resources of India to be used in industrial use by developing injection moulding granules,Services,2021,2019,"Vibha Mittal, Anubhav Mittal",JITO Angel Network,2
2228,Powerplay,Unknown,5200000.0,Bangalore,Powerplay helps simplify end to end Construction and Architecture project management.,Real Estate,2021,2020,"Shubham Goyal, Lesh Dixit","Sequoia’s Surge, Accel Partners",1
2229,Accio Robotics,Unknown,3500000.0,Bangalore,Accio Robotics is involved in the designing and manufacturing of state-of-the-art Robotics Automation solutions.,Technology,2021,2020,"Tuhin Sharma, Pranav Srinivasan",Uday Sodhi,1
2231,Avishkaar,Pre-Series,600000.0,New Delhi,India's leading Ed-Tech startup spearheading the Maker Revolution in the sub-continent,Education,2021,2014,"Rajeev Gaba, Tarun Bhalla",Auxano,7
2232,Jobsgaar,Seed,140000.0,New Delhi,India's first District level/ Hyper Local Job discovery platform,Human Resources,2021,2020,Atul Pratap Singh,SucSEED Indovation Fund,1
2233,Almo,Seed,3500000.0,Gurugram,Almo is a Premium Men's essentianls wear brand focused on bringing sophisticated yet functional designs to wardrobe.,E-commerce,2021,2020,Abhishek Shah,Angelist India,1
2234,Breathe Well-being,Pre-Series,1000000.0,New Delhi,Breathe Wellbeing is an interactive and personalized platform that helps organization increase employee engagement and productivity.,Healthcare,2021,2015,"Aditya Kaicker, Rohan Verma","Stanford Angels and Entrepreneurs India, Anjali Bansal",6
2235,GalaxEye,Pre-Seed,3500000.0,Chennai,GalaxEye enables businesses to make better Decisions & perform operations efficiently via Space Technology.,Technology,2021,2020,"Denil Chawda, Kishan Thakkar, Pranit Mehta, Satyanarayanan Chakravarthy, Suyash Singh",Speciale Invest,1
2236,Good Health Clinic,Unknown,5000000.0,Hyderabad,Full Stack Digital Health Clinic,Healthcare,2021,2021,Samarth Sindhi,Khosla Ventures,0
2238,MYBYK,Pre-Series,1000000.0,Ahmedabad,MYBYK is an app that provides premium bicycle sharing and rental service.,Real Estate,2021,2014,Arjit Soni,Avon Cycles,7
2240,Crejo.Fun,Seed,3000000.0,Bangalore,Crejo.Fun is a digital extracurricular learning platform being built with an intent to help children discover their passions and interests through creative learning.,Education,2021,2020,Vikas Bansal,"Matrix Partners India, 021 Capital",1
2241,Bambinos,Seed,500000.0,Bangalore,Cohort based extracurricular course for kids,Education,2021,2020,"Ashish Gupta, Ankit Hetamsaria","HNIs, Angels",1
2242,KreditBee,Unknown,8000000.0,Bangalore,KreditBee is a digital lending platform developed to assist young professionals with their personal finances.,Finance,2021,2018,"Karthikeyan Krishnaswamy, Madhusudan Ekambaram, Wan Hong","NewQuest Capital Partners, Motilal Oswal Private Equity",3
2243,Spardha,Pre-Series,400000.0,Pune,"Spardha School Of Music, Spardha Academy, Spardha Online are associated marks with Spardha Learnings Private Limited.",Education,2021,2016,"Saurabh Srivastav, Amrita Srivastav",Inflection Point Ventures,5
2244,Onelife Nutriscience,Unknown,3500000.0,Mumbai,Onelife Nutriscience is a consumer healthcare brands company.,Healthcare,2021,2019,Gaurav Aggarwal,Lasons India,2
2245,Flatheads,Unknown,3500000.0,Bangalore,Flatheads is a lifestyle brand that designs and creates shoes from India for the world. Flatheads launched India's first bamboo footwear.,Lifestyle,2021,2019,"Ganesh Balakrishnan, Utkarsh Biradar","Pankaj Chaddah, Srivatsan Rajan",2
2246,Fable Fintech,Series A,3500000.0,Mumbai,"Fable Fintech is being seed-funded by the CCAvenue Group, South East Asia’s number 1 eCommerce service provider",Finance,2021,2015,Naushad Contractor,Paytm,6
2247,Holisol,Unknown,3000000.0,New Delhi,HoliSol Logistics Is a Supply Chain Operations Company!,Transportation & Logistics,2021,2009,"Manish Ahuja, Naveen Rawat, Rahul Dogar","BlackSoil, CLSA Capital Partners",12
2248,Now&Me,Unknown,1000000.0,New Delhi,"Now&Me is a safe cocoon in the form of discussion forums, for you to let out your most intimate thoughts.",Healthcare,2021,2018,"Bani Singh, Drishti Gupta","Saama, Whiteboard Capital",3
2249,Fyllo,Seed,400000.0,Bangalore,Fyllo brings farms on palms by installing on field devices and actions on top of this data.,Agriculture,2021,2019,"Sudhanshu Rai, Sumit Sheoran","Indian Angel Network, Titan Capital, Lead Angels",2
2250,Cora Health,Unknown,3500000.0,Bangalore,Social Commerce Marketplace for health and wellness. Help people discover products suited to their health needs.,Healthcare,2021,2020,"Shrijit Venkatesh, Snigdha Kumar",Inflection Point Ventures,1
2251,Blaer Motors,Unknown,300000.0,Chennai,Meant to augment human power and not completely replace it,Transportation & Logistics,2021,2014,Abinesh Ekambaram,The Chennai Angels,7
2252,Swiflearn,Pre-Series,3000000.0,Gurugram,Swiflearn provides online tuition classes to small batches to ensure personalised learning.,Education,2021,2019,"Abhinav Agarwal, Anand Bakode","Venture Highway, Stellaris Venture Partners",2
2253,Cashfree,Unknown,3500000.0,Bangalore,Cashfree is a payments and banking technology company that enables businesses in India to collect payments online and make payouts.,Finance,2021,2015,"Akash Sinha, Reeju Datta","State Bank of India, Y Combinator",6
2254,QuickSell,Pre-Series,2000000.0,Mumbai,B2B Mobile Commerce Platform,E-commerce,2021,2017,Deepak Bhagchandani,"Sanjay Baldwa, Ajay Jain",4
2255,Truemeds,Series A,5000000.0,Mumbai,Truemeds is a health-tech startup.,Healthcare,2021,2019,"Akshat Nayyar, Kunal Wani",InfoEdge,2
2256,Candes,Unknown,3000000.0,New Delhi,Candes is a home appliances company providing a complete range of home & kitchen electrical appliances at affordable prices.,E-commerce,2021,2015,"Sandeep Aggarwal, Vipin Aggarwal","Nitin Passi, Ruchirans Jaipuria",6
2257,MediBuddy,Unknown,3000000.0,Bangalore,"MediBuddy is a digital healthcare platform for inpatient hospitalization, outpatient services, and corporate wellness benefits.",Healthcare,2021,2000,"Satish Kannan, Enbasekar","Stride Ventures, InnoVen Capital",21
2258,F5,Pre-Series,300000.0,New Delhi,F5 is a foods and beverages company.,Food & Beverages,2021,2018,"Lalit Aggarwal, Raghav Arora","Venture Catalysts, Jeevak Gupta",3
2259,Capital Float,Unknown,6000000.0,Bangalore,Capital Float is an online platform that provides working capital finance to SMEs in India.,Finance,2021,2013,"Gaurav Hinduja, Sashank Rishyasringa","Triodos Investment Management, SAIF Partners",8
2260,IntelleWings,Seed,100000.0,Panchkula,"IntelleWings develops Sanctions & Anti-money laundering solutions with a clear, concise, and fresh perspective.",Technology,2021,2019,Pramod Sharma,Inflection Point Ventures,2
2261,Shyplite,Unknown,1000000.0,New Delhi,Enable E-retailers to automate their logistics and increase efficiency in shipments by providing a single window shipping platform,Transportation & Logistics,2021,2016,"Nisschal Jain,  Sugam Jain, Parinay Itkan",N+1 Capital,5
2263,Greenjoules,Series A,4500000.0,Pune,Greenjoules is a green energy technology startup that specializes in making renewable biofuels.,Energy,2021,2018,"R. Sethunath, V S Shridhar, V. Radhika, Viraraghavan Sankaran",Blue Ashva Capital,3
2264,MentorKart,Seed,150000.0,New Delhi,MentorKart™ helps to fulfil dreams and take that big step towards success.,Services,2021,2018,"Ashish Khare, SK Mohanty","Amit Singal, Manish Aggarwal",3
2265,Leverage Edu,Debt Financing,2000000.0,New Delhi,AI-enabled marketplace designed to help students with their higher education and career growth plans,Education,2021,2017,Akshay Chaturvedi,"Trifecta Capital Advisors, Blume Ventures",4
2266,Kale Logistics,Series A,5000000.0,Thane,Kale Logistics Solutions is a global IT solutions provider focused on providing cutting-edge technology solutions to the Logistics industry.,Transportation & Logistics,2021,2010,"Amar More, Vipul Jain",Inflexor Ventures,11
2267,CustomerGlu,Unknown,320000.0,Bangalore,CustomerGlu is a Low code Interactive Engagement platform to improve user stickiness.,Technology,2021,2016,"Prateek Gupta, Raman Shrivastava, Sumant US","Kumar Aakash, Amit Singhal",5
2268,Cell Propulsion,Unknown,2000000.0,Bangalore,Cell Propulsion is a fleet electrification company developing solutions for large scale electrification of commercial vehicle fleets.,Manufacturing,2021,2016,"Nakul Kukar, Paras Kaushal",growX ventures,5
2269,Wellbeing Nutrition,Unknown,3500000.0,Mumbai,Organic whole food nutrition to keep up with the pace at which we live,Healthcare,2021,2019,Avnish Chhabria,Klub,2
2270,Pee Safe,Series A,3000000.0,Gurugram,Redcliffe Hygiene Private Limited is India's fastest growing hygiene company.,Healthcare,2021,2013,"Dheeraj Jain, Srijana Bagaria, Vikas Bagaria","Shaival Desai, Alkemi Venture Partners",8
2271,Chqbook,Unknown,1000000.0,New Delhi,"Chqbook is a fintech startup that allows customers to explore, compare, book and get personal finance products.",Finance,2021,2017,"Mohit Goel, Rajat Kumar, Sachin Arora, Vipul Sharma","Aavishkaar Venture Capital, YWC Venture Capital",4
2272,SimpliContract,Seed,1800000.0,Bangalore,"SimpliContract is an Enterprise SaaS offering, focused on end to end Contract Life-cycle Management.",Technology,2021,2020,"Guru Venkatesan, Jinaraj PG, Makesh Kumar",Kalaari Capital,1
2273,Dropshop,Pre-Series,1000000.0,Bangalore,Building technology to make distribution efficient and cheaper for large and small FMCG companies,Transportation & Logistics,2021,2019,"Udit Dhawan, Rohit Fernandes, Ravi Teja",Inflection Point Ventures,2
2274,Jumbotail,Debt Financing,4000000.0,Bangalore,Jumbotail is an operator of an online marketplace that simplifies food and grocery shopping.,E-commerce,2021,2015,"Ashish Jhina, Karthik Venkateswaran",Alteria Capital,6
2276,Power Gummies,Unknown,1000000.0,New Delhi,Power Gummies are a team of passionate givers who are dedicated to catering nutritional supplements,Lifestyle,2021,2018,Divij Bajaj,"Venture Catalysts, 9unicorns",3
2277,Convosight,Series A,9000000.0,New Delhi,A mission - to help community builders become community entrepreneurs.,Technology,2021,2019,Tarun Dhamija,Qualgro,2
2278,Junio,Seed,600000.0,New Delhi,Junio is a kids-focused digital pocket money-smart card.,Finance,2021,2020,Ankit Gera,"Amit Lakhotia, Pravin Jadhav",1
2279,Wherehouse.io,Seed,3500000.0,New Delhi,"Wherehouse.io is a supply chain intelligence company, helping brands to move closer to their customers enabling faster and better deliveries and accelerating business growth.",Transportation & Logistics,2021,2020,"Vaibhav Chawla, Jeevan Prakash, Lavelesh Sharma",Better Capital,1
2280,Flexmoney,Series A,4800000.0,Mumbai,"Flexmoney’s mission is to address the enormous digital credit market opportunity created by the disruption from e-commerce, EMI and BNPL checkout finance",Finance,2021,2015,Yezdi Lashkari,Pravega Ventures,6
2283,XYXX Apparels,Series A,4000000.0,Surat,"XYXX Apparels,which runs an eponymous innerwear brand",Lifestyle,2021,2017,Yogesh Kabra,Inflection Point Ventures,4
2284,WaterScience,Unknown,3500000.0,Bangalore,The aim of making good water affordable and accessible.,E-commerce,2021,2014,Sudeep N,Inflection Point Ventures,7
2286,Vital,Pre-Series,3000000.0,New Delhi,"An affordable, digital health plan built around to cover both big and small expenses",Finance,2021,2018,Rahul Kumar,BLinC Invest,3
2287,Juicy chemistry,Unknown,3500000.0,Coimbatore,Juicy Chemistry operates as an eponymous consumer brand.,Healthcare,2021,2014,"Megha, Pritesh Asher",Spring Marketing Capital,7
2288,Samaaro,Unknown,125000.0,Bangalore,"Samaaro is a virtual event platform designed to help organizations host scalable, secure, and effective virtual events for a global audience",Technology,2021,2020,"Mayank Banka, Purnank Prakash, Skandha Gopalan","Chaitanya Kalipatnapu, Kedar Gavane",1
2289,Imagimake,Pre-Series,500000.0,Mumbai,An innovative play system to help children create their imagination,Finance,2021,2011,"Disha Katharani, Ravi Kumar","Roha Investment Managers, angel investor Saumil Shah",10
2290,MSMEx,Pre-Series,1000000.0,Andheri,MSMEx connects micro and small Business Owners with curated Business Experts over live video.,Education,2021,2019,"Amit Kumar, Vishal Kumar, Dilip Kumar, Khushboo Arora, Kumar Sambhav","TNF Ventures, Razorpay",2
2292,saarthi.ai,Seed,3500000.0,Bangalore,Multilingual Conversational Enterprise AI Platform for omnichannel automation of customer journeys in the user's native language.,Technology,2021,2017,"Piyush Dangaich, Sameer Sinha, Sangram Sabat, Vishwa Nath Jha",Nvidia Inception,4
2294,Superplum,Pre-Series,3800000.0,Noida,Building India's most sophisticated platform for high quality fresh food,Agriculture,2021,2019,Shobhit Gupta,Marquee investors,2
2295,Upside AI,Seed,1200000.0,Mumbai,Upside AI on the thesis that technology will make better investing decisions than humans over the long term.,Finance,2021,2017,"Kanika Agarrwal, Nikhil Hooda, Atanuu Agarrwal",Endiya Partners,4
2296,PazCare,Unknown,3500000.0,Bangalore,Paz Care is India's leading Employee Benefits & Health insurance platform,Finance,2021,2021,Sanchit Malik,"Ashish Hemrajani, Parikshit Dar",0
2297,Answer Genomics,Unknown,3500000.0,Bangalore,A healthcare company that uses genome-based data to help individuals make decisions.,Healthcare,2021,2019,Rahul Ranganathan,"India Accelerator, Lyxel&Flamingo",2
2298,Skillmatics,Series A,6000000.0,Mumbai,Skillmatics develops learning games for pre-school and primary school kids aged under 10,Education,2021,2016,Dhvanil Sheth,Sequoia Capital India,5
2299,Bimaplan,Pre-Series,2500000.0,Bangalore,Affordable insurance for the next billion Indians,Finance,2021,2020,Vikul Goyal,"Roshan Abbas, Ritesh Malik",1
2300,Bueno Finance,Seed,3000000.0,Gurugram,"Bueno Gig Growth Technologies Pvt Ltd (""Bueno Finance"") is a financial services platform which aims is to help improve the financial health of customers.",Finance,2021,2019,"Saurav Gandhi, Sandeep Arora","Goat Capital, JAM Fund",2
2304,The Switch Fix,Seed,3500000.0,Gurugram,The Switch Fix is a plant-based clean and conscious personal care brand for young urbans.,Healthcare,2021,2019,"Abhishek Kumar, Rhea Shukla","Venture Catalysts, 9unicorns",2
2305,Anvidha Technologies,Seed,1500000.0,Haryana,Anvidha Technologies Private Limited is a HARYANA based private ltd.,Technology,2021,2020,Ganesh ranganathan iyer,Inflection Point Ventures,1
2306,DigiSparsh,Seed,3500000.0,Mumbai,DigiSparsh is India's first and only healthcare fintech platform which aims to make healthcare facilities accessible to everyone in the country.,Finance,2021,2020,"Saurabh Soni, Akhilesh Gandhi",GoAhead Ventures,1
2307,CoffeeMug.ai,Pre-Seed,620000.0,New Delhi,"A video first global platform of senior professionals, connecting 1:1, virtually or over coffee, building a powerful, long-lasting relationship.",Technology,2021,2020,"Abhishek Sharma, Dipti Tandon","Paradigm Shift Capital, AngelList India",1
2308,Pathfndr.io,Pre-Series,3500000.0,Bangalore,Intelligent Travel Tech Stack making sense of the world's information by scanning billions of data points and ranking destinations,Technology,2021,2015,Varun Gupta,Arali Ventures,6
2309,BigLeap,Unknown,600000.0,Hyderabad,BigLeap Technologies & Solutions is focused on providing viable offshore consultancy services for enterprises looking to grow their business.,Human Resources,2021,2015,"Jamesh Johnson, Sainath Malkapuram Goud",Anup Kumar Yama,6
2310,Kazam,Seed,900000.0,Bangalore,"Kazam provides end to end Electric Vehicle charging solutions for Office Spaces, Apartments, Restaurants, Shops",Manufacturing,2021,2020,"Akshay Shekhar, Vaibhav Tyagi",Inflection Point Ventures,1
2311,MYRE Capital,Unknown,3500000.0,Mumbai,Democratising Real Estate Ownership,Real Estate,2021,2020,Own rent yielding commercial properties,Aryaman Vir,1
2312,BimaPe,Pre-Seed,500000.0,Mumbai,BimaPe demystifies Insurance and its Management for individuals and families across India. 'BimaPe Bharosa Karo',Finance,2021,2020,Rahul Mathur,"iSeed, Titan Capital",1
2313,MicroDegree,Unknown,3500000.0,Mangalore,MicroDegree is an ed-tech platform working towards democratising technology and job ready skills for Bharat.,Education,2021,2019,"Gaurav Kamath, Rakesh Kothari, Manikanta Nair",Research Innovation Incubation Design Labs,2
2314,Saarthi Pedagogy,Unknown,3500000.0,Ahmedabad,"India's fastest growing Pedagogy company, serving to school as an academic growth partner and provide 360° solutions to schools on Academic Strategies",Education,2021,2015,Pedagogy,Sushil Agarwal,6
2315,Synapsica,Series A,4000000.0,New Delhi,Artificial Intelligence tools to make quality diagnostic assessment available for all.,Healthcare,2021,2017,"Meenakshi Singh, Dr Cherian, Kuldeep Singh Chauhan","IvyCap Ventures, Endiya Partners",4
2316,Kwik Foods,Seed,3500000.0,Gurugram,Kwik Foods is one of the fastest-growing D2C fresh food brands that is disrupting the food industry,Food & Beverages,2021,2020,"Prabhleen Kaur, Harshal Patel",9Unicorns,1
2317,Plutomen,Unknown,300000.0,Ahmedabad,Plutomen Technologies Pvt Ltd founded in Nov 2016 is recognized start-up by DIPP in the field of Emerging Technology.,Technology,2021,2016,Keyur Bhalavat,"GUSEC Seed Fund, DeVX Venture Fund",5
2319,Grinntech,Unknown,2000000.0,Chennai,"Grinntech is an investor backed, growth phase start-up, leading on all front of battery design for EV applications.",Manufacturing,2021,2013,"Nikhilesh Mishra, Puneet Jain",Inflection Point Ventures,8
2321,Green Cure,Pre-Series,3500000.0,New Delhi,World's first company to combine German Engineering with Indian Ayurveda in health products,Healthcare,2021,2015,Sanchit Garg,Venture Catalysts,6
2323,WINDO,Seed,500000.0,Hyderabad,Convert Instagram Page Into an Online Store in under 2-minutes. Create a free online store and automate your sales.,E-commerce,2021,2020,"Silus Reddy Chintapalli, Rakesh Vaddadi",Unicorn India Ventures,1
2324,ApnaKlub,Pre-Series,3500000.0,Bangalore,Supporting independent businesses and retail entrepreneurs with better than market wholesale prices and supply chain.,E-commerce,2021,2020,"Shruti, Manish Kumar","Blume Ventures, Whiteboard Capital",1
2325,LegalPay,Unknown,3500000.0,New Delhi,A tech focused B2B litigation finance company in India.,Finance,2021,2019,Kundan Shahi,Ashwini Kakkar. 9Unicorns,2
2326,Lavado,Unknown,3500000.0,Mumbai,A startup that is trying to permanently change the way people approach the cleaning and maintenance of their apparel and accessories.,Services,2021,2016,Disha Jain,Ashish Shah,5
2327,Navars,Unknown,3500000.0,Hyderabad,"Navars Edutech comprises dynamic mix of intellectual professionals, managerial team, Subject matter experts and Astronomy and Space researchers.",Education,2021,2019,Sravan Varma Datla,Faad Network,2
2329,Loco,Seed,9000000.0,Bangalore,Loco is India's leading live game streaming app.,Media & Entertainment,2021,2018,"Anirudh Pandita, Ashwin Suresh","Krafton, Lumikai",3
2330,Auric,Pre-Series,2000000.0,New Delhi,Contemporary Beauty & Wellness Brand Based on Ayurveda,Healthcare,2021,2017,Deepak Agarwal,Venture Catalysts,4
2331,Edmingle,Unknown,300000.0,Bangalore,Edmingle is a platform for all educators who want to launch their courses and sell them online.,Education,2021,2016,Gaurav Doshi,"Indovation Fund, Mumbai Angels",5
2333,Humit,Pre-Seed,3500000.0,Bangalore,Humit is a social networking app for music sharing and discovery.,Media & Entertainment,2021,2020,"Rohit Ganapathy, Prithvi Sankar, Ishaan Negi",Antler India,1
2334,Airblack,Series A,5200000.0,Gurugram,Airblack is on a mission to help people convert their passion to a livelihood.,Technology,2021,2019,"Videt Jaiswal, Vaibhav Raj Gupta","Edge Ventures, Elevation Capital",2
2335,NIRAMAI,Unknown,3500000.0,Bangalore,"NIRAMAI has developed a novel breast cancer screening solution that uses Thermalytix, i.e. machine intelligence over thermography images.",Healthcare,2021,2016,Geetha Manjunath,CDC Group,5
2336,Intervue,Seed,3500000.0,New Delhi,World's fastest collaborative environment to take tech interviews.,Technology,2021,2021,"Rahul Arora, Pushpender Singh Rautela","Titan Capital, Kunal Shah",0
2337,Nestroots,Seed,100000.0,Gurugram,"Ottoman, Stool, Brass Kitchen Solutions, Masala Box, Roti Box, Bar Accessories and Many Gifting Options at Nestroots.",Lifestyle,2021,2016,Chhavi Singh,We Founder Circle,5
2338,Detect Technologies,Unknown,12000000.0,Chennai,Detect Technologies is a leading Industrial AI company that is building innovative solutions and cutting-edge technology for the industrial ecosystem.,Technology,2021,2016,Daniel Raj David,"Accel Partners, Elevation Capital",5
2339,CredR,Unknown,6500000.0,Bangalore,CredR is India’s Most Trusted Used Two-Wheeler Consumer Brand that leverages Technology & Processes to simplify the Used Two-wheeler Market.,Manufacturing,2021,2015,Sasidhar Nandigam,"Yamaha Motors, Omidyar Network India, Eight Roads Ventures",6
2341,TABLT,Series A,3000000.0,Kolkata,TABLT [Previously Sabse Sasta Dukaan] is one of India's most trusted online pharmacy dealing in medicines and other healthcare products.,Healthcare,2021,2018,Anish Agarwal,Siti Cable,3
2342,Hesa,Seed,2000000.0,Hyderabad,HESA is connecting Bharat with India and India with Bharat Phygitally. We are bridging the gap for the world’s largest customer base that resides in rural India.,Technology,2021,2020,"Vamsi Udayagiri, Hema Nandiraju","Venture Catalysts, 9unicorns",1
2343,Powerhouse91,Seed,3500000.0,Gurugram,"A tech-driven company that acquires, operates, and scales outstanding ecommerce brands in India.",Retail,2021,2020,"Shashwat Diesh, Aqib Mohammed",Crossbeam Venture Partners,1
2344,Nalanda Learning,Unknown,5000000.0,Kolkata,India's 1st Online Preschool with Blended Learning Model,Education,2021,2011,Tamal Mukherjee,Aavishkaar Capital,10
2345,Chargeup,Pre-Series,3500000.0,New Delhi,"""Battery as a Service"" for 3 wheeler & 2 wheelers",Energy,2021,2019,"Varun Goenka, Akshay Kashyap",Mapmyindia,2
2346,Knackit,Unknown,100000.0,Bangalore,Knackit is a talent sharing platform where users can showcase and monetize their artistry.,Technology,2021,2019,"Pranjal Kumar, Akanksha Bhardwaj",Jyoti Bansal,2
2347,Treebo Hotels,Later Stage,16000000.0,Bangalore,Treebo Hotels is India's most loved hotel chain in the premium-budget segment.,Hospitality,2021,2015,"Sidharth Gupta, Kadam Jeet Jain, Rahul Chaudhary",Accor,6
2348,Raptee Energy,Unknown,700000.0,Chennai,Raptee Energy Inc. is looking to accelerate the transition to smart and sustainable mobility!,Manufacturing,2021,2019,Phunith Kumar,Inflection Point Ventures,2
2349,Meddo,Unknown,6000000.0,Gurugram,Meddo (Arctern Healthcare) are re-defining how primary and secondary healthcare is provided in India through a connected care delivery platform.,Healthcare,2021,2018,"Saurabh Kochhar, Dr Naveen Nishchal","SRI Capital, Picus Capital, Alkemi Capital",3
2350,Supertails,Pre-Series,2600000.0,Bangalore,Supertails is building a digital pet care platform which offers expert led healthcare services and products.,Healthcare,2021,2021,"Vineet Khanna, Varun Sadana, Aman Tekriwal","Saama Capital, DSG Consumer Partners",0
2351,SkilloVilla,Seed,300000.0,Bangalore,Mission to support young graduates in enhancing their learnings and transform them into big earnings.,Education,2021,2020,"Ronak Agrawal, Rajat Agrawal, Deepak Kharol",Titan Capital,1
2352,Cancer Clinics,Pre-Series,1500000.0,Telugana,"Cancer Helpline is a source of information and support, helping with all the things that people affected by cancer want and need.",Healthcare,2021,2014,"Sonali Srungaram, Sasi Sunkara",Axilor,7
